first_name,last_name,cif_code,dob,address,comments,payment_status,customer_status,hold_amount,product
Veronica,Thomas,gAAAAABqAcdugaxD2ESfQMz1VSMZNOR_ufCrdWJxildaVNXEBaxuYKP3DcY1Hzl__sVI_PTQCyx4DnzksUuDoqw6KBPB7HAZlw==,1998-03-12,"78157 Jennifer Roads, Anthonyborough, NE 13458",Raise it at theory attorney leave recent many subject assume.,unpaid,found,2910.87,Personal Loan
Daniel,Spencer,gAAAAABqAcdu8K6C5_PPx_ydXf1n56jGOaah2PhcYiZnOwmMZJyhC9uJfUXtj3yXk7NW7sPy7jd1IWDfJDOzqvqF1a8VVYDplA==,1995-03-19,"75785 Gregory Glens, Michelleview, ID 52519",Owner form understand data skin garden.,unpaid,not_found,2109.48,Credit Card
William,Harris,gAAAAABqAcdu-BvwWspaeHrCz1eMgdDIsce7DgKE5mja6lU9wXKOtJgyZLwYPvlp_w2clD6-FjYqakjj0-NJinXMScRjO6ICng==,1981-02-10,"79407 Perry Via Apt. 440, Carlahaven, WV 76679",Within across maintain good all play any.,paid,not_found,3838.9,Credit Card
Kevin,Miller,gAAAAABqAcdutyT-aruugDLVkiu8wEVFZAt7E_MCGguFYMrfVFfpDpqlUQLTNVZqP4Ma1Qn7mYRIYERCUigpbqOIg4AZDU9FgA==,1970-03-06,"Unit 4911 Box 5936, DPO AA 47369",Me between admit agent skill security guy quality low.,paid,found,4090.0,Credit Card
Maria,Hines,gAAAAABqAcduD9YpgGMAW6f33FdoUeaRxErd7Gmt7k8JPpBLbroMEPnhUiNG12FrIv2muyVRZZJmXbRIaZuBWaig1tSAzeaq3Q==,1953-05-25,"8727 Melissa Wells Suite 864, Jacquelinemouth, WV 59429",Budget member green president sure.,unpaid,not_found,3490.81,Personal Loan
Mary,Jensen,gAAAAABqAcduESAn1kr-HCJrqcUAxyzX5vVNgK6Zb2fTG5pwajSK5gojD0FpJH-uIjoBuXiqO4fPoiZcYkgZln3jQxRAXpeasA==,1969-09-14,"4202 Jeanette Gardens, West Tylerport, VA 82186",Usually could think body positive determine.,paid,not_found,2738.55,Personal Loan
Mary,Long,gAAAAABqAcdunqxpo0bGiBFxBaVkKoeQNokrAuRhfPavqVtV9T7q64Hy3jrCOEb_4aSLdJDx4RuYnx6AhTBWinLwCSEGdYFZsw==,1977-01-06,"23819 Thomas Hills, Port Michaelbury, NV 58413",Party cup life food suddenly five.,paid,found,3493.07,Personal Loan
Kayla,Jones,gAAAAABqAcdu2dXj2RUTncUfHfdjc7dxN-Qr71rfc_V-jowsjzq2juUgAu1wu-nJ_Nl1GyLQrmM4X17nuvm_1_cz0x6cYr_15w==,1961-06-02,"413 Joshua Hill, Lake Toddfurt, VT 86500",Generation her himself see smile that.,unpaid,found,854.63,Credit Card
Tiffany,Stout,gAAAAABqAcduz7pjOLJZ9s4oixygWXcoBYH1DoVZ2Nlk2odqVGX4msQBZXYMQ_fLpjJcFXXVa5zvkHdVzjNroXqzb2J5deKb1Q==,1961-07-22,"2890 Joseph Landing Apt. 263, Port Richardmouth, MT 82183",Follow interest cost exactly century develop enjoy few finish.,paid,not_found,3886.05,Personal Loan
Nicole,Brandt,gAAAAABqAcduDPHGvmv6fO6hCmcHVzgs4WH6khFsxvLn42A--nYfCPpp0o_2xwWAMJG_rFd8bACMQ5nnD6TbBJc2hHMoVUvfyg==,1952-11-02,"3836 Bryan Square, Levifurt, MN 20886",Form population many beyond board.,unpaid,not_found,3060.21,Home Loan
Andrew,Richard,gAAAAABqAcdurQan9ea7tHXNjeifZkpNDnueQsLnqvRuAuMLXc4LZf00HYnzPoZ2tp9LWdHJxZRF-iMrorW-JDeC9KJJtjubtQ==,1962-12-23,"35056 Whitaker Causeway, Valenciamouth, NJ 50680",Break far tonight carry western enjoy young.,paid,not_found,435.34,Personal Loan
Kristen,Peters,gAAAAABqAcducWv0aoj4XB5xcyhKb2smu6YHh1MGlRKDg6VPBe_o1ZTCWJZxTxV9_ZpAggodaa6mTrgQB2MqFp1v53L-A0bg1g==,1990-01-26,"592 Baird Mountains Apt. 929, West Christinechester, AK 48840",Box fish fund employee edge back together professional speech television.,paid,not_found,4975.99,Credit Card
Dawn,Rosario,gAAAAABqAcduZrKcjc0Xd4ExBmY_iu-nnbTZHC7y785KueuX0kg2lm4lxvVLe0WyLRL7mZvO6pPW0McBgs4uAA8e8iBLUlM0ug==,1998-06-16,"3288 Daniel Plains, East Lauraberg, GA 42149",Wind phone last truth quite matter may wife shake.,paid,found,881.23,Credit Card
Melissa,Lee,gAAAAABqAcdux598ve9CjQZOT_3AFKhW0tMxVGy5cD_QGApdou0wIjKpoYYiHetqt0-aR0RPkqWy7Z72Hx21sxHBeL8ICpKcqQ==,2008-03-13,"USNS Jones, FPO AA 80149",Might remain much office base door somebody.,paid,found,1711.67,Home Loan
Erin,Lopez,gAAAAABqAcdu2edVKK3wUt71UdAXIDNpaFG7kkd-b_DDlyY0ruHyF9mbJvUf2OnwiyqjrbmaXsj_2UU9Rq5n20Ib8hEs7xqvWA==,1999-05-10,"0787 Edward Ridge, Walkermouth, FL 93412",Water wrong information ball second finish amount character.,unpaid,not_found,4992.98,Home Loan
Robert,Rice,gAAAAABqAcduaCMu2TxS5kVpCiBX4xNrfH87O-LOa9buH0VFFF7ED6ts_5IG9itOB1PxudlVKiNab0Q5w4Fqt4pz29eqptsZ8A==,1947-12-04,"4551 Stewart Station, Anthonymouth, OR 18399",Animal college financial technology score entire PM.,unpaid,found,1055.59,Credit Card
Jeremiah,Williams,gAAAAABqAcdubSwy5JSwiOE6acTmawiiriEGQr9THh6QsRw35ovT9bdikdHWT2A6RjOp5Lar_5kKwxFyGabKzRoUWkNTLx0qhQ==,1983-04-24,"8613 Logan Harbors Suite 016, South Todd, OH 25529",Media realize learn certainly plant brother indeed answer.,unpaid,found,4325.63,Personal Loan
Christopher,Wilson,gAAAAABqAcduaaY-5vtE-in5YSL7usZWCWIt4XDm3pkv5n2YWy31KisR8VJDXm-c4PMU7OYh4SfnCcKB0Ps2JChR4IUfHaE-_Q==,1948-10-28,"33111 Johnson Springs Apt. 084, Elizabethport, HI 58915",News whatever seven lose trade whatever seven over between treatment.,paid,found,362.57,Credit Card
David,Rodriguez,gAAAAABqAcduFm-nY28zRe_870s2isqlwtDqXMbVeY5zXTtXbXrNKBsELDOBtgmFj2jOJSSZBR74zxm4rCgZPFqi709HOQGIoA==,1962-07-27,"06344 Stephanie Shoals, Luisville, DC 93264",Arm trouble already later response thing.,unpaid,found,4540.84,Credit Card
Stanley,Schmidt,gAAAAABqAcduxkQOGFnFaTNOLSpgG5FnL4EtLKh40Isq-n2b8HlmGSnjuYpHWSEWzY6YARuRP89w_20cVlLmARZk8MZ9vYYDMg==,1972-10-25,"PSC 5343, Box 9579, APO AP 87092",Fill recent figure save our must husband up.,unpaid,not_found,4379.1,Personal Loan
John,Contreras,gAAAAABqAcduUlL1px75wprUpGPC4nNAOFXvZ8Yh9yLp-WRBRtdXmC2OiOX7UwuP7iz2D9dSS-tqkPU8Yi0zWCc7wOURlx6CSA==,1983-06-05,"42496 Johnson Fort, West Sethberg, KY 20224",First some wish food alone.,unpaid,not_found,4921.45,Credit Card
Allison,Wu,gAAAAABqAcdu4iCp3SrmGeHyNdxPj4RQ8WegnQWcNBIbxXsQtuxcMbD0lcIUB75YdPgofTCDvC5h5H9Jwn1fTXm-cV4h1588MA==,1982-02-06,"4910 Carlos Prairie, New Rebeccaland, AL 56110",Choose kind fight direction news letter.,unpaid,not_found,2976.65,Personal Loan
Martha,Kline,gAAAAABqAcduozHRe7jny7CE-vHef16oc2n1eLIY7euutspLjCR0m-4zNMo7l1vS6HJdXv2ZOSUhLPY-ZsGQe5_Pd6q3p5pyqg==,1964-11-10,"53850 Kim Forges Apt. 363, North Brandonland, MD 41670",Participant then treat sport.,unpaid,found,4048.07,Personal Loan
Peggy,Wright,gAAAAABqAcduUFLuDqZE-TKi8j4DEabDUaiNQgTt_8MkNrnfGBj9x0DfJXzlMyhGPWTm9jk74ja4i6pfOKnOshtKBs00l88Zmg==,1955-11-17,"8505 Smith Plains Apt. 146, South Richard, NC 05399",Onto agree system already set sing institution.,paid,not_found,1001.58,Personal Loan
Dennis,Simpson,gAAAAABqAcdumlgp-84XOYUTp88WtnJnoq--CgfyxoPwBLCTLIeRVx5gXFfQpZ4eTcZfjQGjBMJ8H-7REtXqhSaLFH4bmTnItg==,1962-02-02,"1511 Lewis Lane, South Robertbury, ME 78953",Mrs chance attack what for some.,unpaid,found,4415.35,Personal Loan
James,Williams,gAAAAABqAcduwKE_ZqxyK3467rwmm7DrDJqkT4fPInhQUBegmk5eJu5f3NzGHRe8iTbTPkJkjnTTYxRJ4sd2f37iz79cw4lXJg==,1951-07-22,"1215 Joseph Wall, Port Lisa, IN 74796",Read we would include long edge.,paid,not_found,3296.12,Credit Card
Ashley,Wong,gAAAAABqAcduhj3FVXBBwjhoD-NHL1Rq6BE589zlLnqkTZYNGXBui5i8sAMpNwT_Jn5JbgW-8K48bKEuDxfShjUrakmAKi94tw==,1991-01-30,"43916 Amanda Key Apt. 153, South Amandabury, IL 10792",Allow traditional general tough factor parent task approach see report.,paid,found,2431.86,Credit Card
Samantha,Dean,gAAAAABqAcdus_UbPMcJyqlcIv-DxXY5a6xbWdAU-460IB6x0iKSzGXhuDHi326MPxLkQrUYq4OlwZ167Nn_OhfqZcGg9YuBqQ==,2000-08-19,"0608 David Brooks, Coreyberg, VA 06110",Health six side exactly everybody let report heart.,unpaid,not_found,1812.15,Home Loan
Alison,Graham,gAAAAABqAcdu9IUqvC9b2nN0vC9XcnpzzzvpT4vhsRrT0sqJB9AcVCUnDjxZFr50q-HJgM3DF54IMxT3sf4Zou51SO6umBqxzQ==,1955-08-04,"PSC 6780, Box 6236, APO AA 13683",Future international those pretty animal.,unpaid,found,3798.55,Home Loan
Kevin,Haynes,gAAAAABqAcduGU-3agY7ZN4PMxe8rKLVslKTNSjd7sjgyXryMM49wV2X_Bbfa_e9Co1cQDRgX0NJtRKm0S9oyhFKRh_hEse8mQ==,1978-08-04,"16223 Brandt Freeway Apt. 527, Lake Thomas, VA 84669",Century floor forward art also maybe huge body.,unpaid,found,3059.57,Personal Loan
Bradley,Harris,gAAAAABqAcdu9YsaY2NcQD_W4kUCgK1O-ejAWZ5E-pndmfm5i7cY8Qe4WeS41bHZHbAMZ9O8w3OXUC1anP91iiLkko7J_rVCrQ==,1997-01-12,"15329 Stone Tunnel Suite 722, Benjaminmouth, TN 99920",Pass nor girl decision wide.,paid,not_found,2980.07,Personal Loan
Sandra,Pittman,gAAAAABqAcduR9pODjHsoFfnUHA5_cfht0sTqjg1VyNMrRJgbyiJlIEbXNWnIqWqd-h_HdwSpX3laA7Ync-vHIn43o_lnjXL8w==,1963-07-20,"4604 Thomas Streets Apt. 818, Mccallstad, MD 06018",Personal laugh grow what commercial necessary who south boy.,paid,found,391.62,Home Loan
Derrick,Pratt,gAAAAABqAcduPUYdZl3y0aAO3ulepiVkTod8W354tHgkOQFG49Q2gykcnIdWCmt7cxXKDiJ-xK0sjvu50xe9PKGqPgDtn-JOIw==,1951-12-01,"573 Morgan Ramp Apt. 960, Millerport, NM 66954",Bad various born trial continue physical our different.,unpaid,not_found,3444.6,Credit Card
Robin,Turner,gAAAAABqAcduDqlNIhuuGgyOK5xoJeN4d8664zAGDkdO7qfzGEJFeE014QAz9y4M6rFEr759YufUgdGPEG2CscgLIG39RGMyNA==,1969-09-18,"854 Timothy Square Suite 278, Rosetown, VT 31684",Hair play go against participant strong room garden friend shoulder.,paid,not_found,3784.61,Home Loan
Sean,Herrera,gAAAAABqAcduJpX8yVqvRAOglmMF0YZVGEjcQWqDjXWr0zITWlw4hwAr6gZd8OFJvJywvN8wnuaaN9lXHaQEdcshOLpkfnfmdg==,1992-01-05,"7177 Allison Passage, Millermouth, TN 55359",Hope however his decide study case hit figure blue cause.,paid,found,3859.77,Personal Loan
Eric,Pugh,gAAAAABqAcduOON4TB5E5JegEvUzMnDXNNnF1gU3pVyaPkLuficR11jyt_2RWPasTUU4vDgsHu-17HIQJyjsU7Xpr9wI5GmXbg==,1997-01-07,"Unit 9316 Box 1795, DPO AP 78227",Total would treat detail design recently who trouble.,unpaid,found,4221.75,Credit Card
Allen,Mcmillan,gAAAAABqAcduRFpYZuw159Ac3QDTE7YFz6u8LWuVLuDuH4sxyI-rzOcXxZkh7K-OaFRVl2s7j0kYCq9QlIiloVT0omX2AgY0-g==,1948-06-10,"09711 Eric Drive Suite 701, Lake Pamelatown, AL 67640",Which fine will health relationship member after woman.,paid,not_found,1565.98,Credit Card
Karen,Parker,gAAAAABqAcdufpFVCJb7ZjJpksV6nCAhmnZH74-uJBnYfGDPFTsBdVglXGxf8TnYFXm8G74kR77exJj2dqMYF57l2qHa7toSLQ==,1948-11-11,"6761 Larry Burgs, Smithberg, WA 07508",Clear art coach fight trouble.,unpaid,not_found,2732.28,Credit Card
Olivia,Walker,gAAAAABqAcduumNU-IVsaMphtw4fKn2Joi0Gm20tE7KV-eOGgoI63-m6ZvFBWM8pcZcGjqCgVurYNS_mnGc0QuWyRQJer10Gjg==,1992-09-05,"73481 Benjamin Orchard Suite 565, West Troy, SD 40782",Represent their start scientist law decision might.,paid,not_found,3711.82,Home Loan
Alec,Jefferson,gAAAAABqAcduGKamHnKl6U3EIl_u5e2AGp7szvCqSTynltjb-y2fZmIEgn68_-lZa1e-3ImrplnJPa11uxNQks2SQ8niEtAwZQ==,1950-02-23,"57596 Smith Walks Apt. 687, Sarahberg, NV 01922",Agreement free technology theory practice risk prevent friend one.,paid,not_found,3099.89,Personal Loan
Jack,Page,gAAAAABqAcduepgCTbim8SRdmGemGCEtpGxevANL3MnQu56aVxZBiNgGzm0fGyyV74ogjjdPI6gPjhaqN1m3oQSJYip4pV4ZJw==,1953-10-26,"8699 Eric Well Suite 029, Smithberg, DE 64876",Represent then thank growth take.,paid,found,4353.57,Home Loan
Erika,Davis,gAAAAABqAcduZkIcvasLH8GB_yZxoD9pKwQ_Huky9Fbwb9Jo84yIbDcs1Ku5F7rRZgqkVYeO2WD8OgjFQpsjF0fVe_z8-VOd4w==,2003-03-13,"471 Kathryn Bridge, North Kristin, NH 13554",Base movement town animal region full hard its happy suddenly young.,paid,found,1181.33,Personal Loan
Jack,Castaneda,gAAAAABqAcduXv7pUE9mOozOUWR7DuE_gVIRzpF1wjUdJdhOlmSjsYoON3cF_v3cNqTy4P35S4VTya8iqA5_8qsLJvtoTC2k6w==,2002-05-05,"3789 Carol Parkway Suite 486, Michaelmouth, ID 05690",Crime easy answer direction agency nothing probably.,unpaid,found,3838.12,Credit Card
Brian,Shea,gAAAAABqAcduEpFGWiaRYq9tAQOhA4DOoGu2sxP1QrLNr1zJh0KCeF9PNdVdDgHbZiBc2bD6bmf0PJkX6sHd7Nqxo0dIQ0Ymqg==,1959-09-11,"867 Lowery Groves Suite 698, Woodview, AZ 61485",Record her hard whole build.,paid,found,4108.86,Credit Card
Tiffany,Bell,gAAAAABqAcdub-ze6hstn5bhK6D9RPnsThJx4m42HanX_g69oCghVhy79DmRgibcUyuX8KChtFMZLdxLxEfOKdV9JA_BjWfyng==,1952-01-02,"03029 Williams Falls, Gonzalesside, KS 30680",Far drive option meeting whether.,paid,not_found,3134.18,Home Loan
Alice,Blackburn,gAAAAABqAcduy0dRWdMffLUCVYBF8PLDg3NMdW9lKMojpp8aJQeGbCAMkugIsiVk3FFzdVPzYN_FdPc3ZUuFucQH7nvujDiShA==,1945-07-07,"7525 Chelsey Key Apt. 863, Jameshaven, KS 14615",Traditional benefit foot well total station arm gas rather.,paid,not_found,4019.6,Credit Card
Troy,Fox,gAAAAABqAcduOQfX-XxbjApo7nteAk3PSdSgG_g7LW7xEznzk1m8Qo2IW0gIWqYLvmaGW8AiuwIj-XRU72ivHDgg-_SrPPfOrg==,1972-05-07,"90638 Johnson Highway Apt. 401, Johnsonland, DC 16320",Smile fact better friend language.,unpaid,not_found,1456.13,Personal Loan
Matthew,Noble,gAAAAABqAcduloIgxC2Zejign5E9E11RPsPrcYYRFsoGiHMUl-nsy-8S2QD7Y4Klb_5gFEn7N6ElFhnbKnueDPd3xxxIO07UKg==,1971-11-28,"2379 Cole River, West Sherrimouth, DC 33679",Market coach talk culture data clear use money factor move.,unpaid,found,3333.29,Personal Loan
Kevin,Carson,gAAAAABqAcdudqBah9XTUAHOe0UxdgpRQM2-EUvjiDX3wvrutBT110sVDVHmtEHOnZ_W-Xba9052Loi-FI6rB07rUg-aiXQupA==,2004-06-10,"0663 Simmons Grove Suite 407, Jasonview, MO 86315",Detail necessary near learn strong everything right writer.,unpaid,found,4518.71,Home Loan
Jacob,Johnson,gAAAAABqAcduj1cNzBdYXiq84OT1NBQsnx9mZtM6P9Cr3nugAE2Eycaa0HdpE9D5pCw1w1gIai37iZtA6g1C3qo6J_P0GcMcYg==,1983-01-27,"79604 Johnson Hill, New Cory, SC 55890",Appear attention certain discuss bill billion.,unpaid,found,685.08,Credit Card
Judy,Smith,gAAAAABqAcduOwMw9gcED3q95PX4tCDioSQZGG3uoVIILgNFch80hubzcjYfjbhHwOR8ZGsDKgFRy1ZYtNb-doN4uMUPBiQFSg==,1991-04-08,"13682 Elizabeth Tunnel Suite 953, North Ryanberg, FL 02566",Bar yard detail else project short.,unpaid,not_found,941.41,Credit Card
Joanna,Barker,gAAAAABqAcduqa3bygwOAGhj-FjFAZ0mmvIzf4hm25DHEGRS6AJYWSYPz--phTiOJsNp55V2fSIQy7xxyNdt5k5wI4srmWBbZg==,2000-08-24,"798 Nguyen Extension Suite 415, North Kyleview, MI 31896",Mind method property house show fall marriage girl single.,paid,found,776.68,Credit Card
Amber,Lee,gAAAAABqAcduIcDWXmaF-APgYJWiBqPfwl241_LsOfyk4YC3pwLfz3vcBh53qE5qJ54XaaO3bC89Z38eOGuAnJ0RsAHHOWIZFQ==,1981-12-11,"00320 Brian Estate, Lauraborough, WA 40873",Expect girl concern artist lot big machine who begin story.,paid,found,1265.59,Personal Loan
Sharon,Bennett,gAAAAABqAcduciY4Q4xXJem5v98adBlTfsNUxcP-wccDufhjOpHFkFFEtEldj7Yp4h4Dv6_KghXFkUPue5NMRMHX7wAfkZuILw==,1978-05-03,"437 Douglas Green, West Jacobbury, WA 62261",Truth statement camera wait why.,unpaid,not_found,3178.82,Personal Loan
Fernando,Williams,gAAAAABqAcduThb76plxf7xHO5PLetSLidaRGbQNMBa01Bn2ryym5y_CqAhACHfwkMGR3dKzooDBZrGYdNLOiFwlAmRw1m252A==,1967-10-04,"7139 Catherine Throughway Suite 623, Lake Brian, VA 28436",After decade individual phone friend popular civil care your area hotel.,unpaid,not_found,4758.76,Personal Loan
Michael,Dorsey,gAAAAABqAcduyEl6Ey2JVbrF6whINhPQ_3rZDmtc8j4HYs9q4Rz2FhraAJm8pKthpk7NwYEvwzpA2d6BBSq_2TXYu6ZykXkqaA==,1961-09-08,"80046 Wallace Locks Apt. 607, West Williamfurt, KS 93189",Poor nature personal yeah range.,paid,not_found,1521.63,Credit Card
Luis,Harris,gAAAAABqAcdu7zV5lQ4AwrxVn9ev4dKrtpEwK-fJ5Vz7km-6mLSVR9lTW0Xm7uG-MYuGuqJw_9_N236PFtrrT2ul_dU21XmudQ==,1974-04-08,"576 Sara Dam, Cheyenneside, MS 49517",Figure feeling offer those option.,paid,found,3614.32,Credit Card
Christina,Jackson,gAAAAABqAcduT0oLiBA9HnUg2k12xxgWHNXAMshBkJC6XX2BrDhCMqcUr0uxq1ljq414MXmiq4KEo56i6ITb7igonYcFq5JQkg==,1981-05-27,"445 Matthew Spring Apt. 399, Jamesstad, ID 87659",Stage pick church major stand.,unpaid,not_found,78.64,Home Loan
Shawn,Ruiz,gAAAAABqAcduSSa9KOar0hk1wbfOz80I-zeYl4YZkoHgWWhpivpSvKo8J9KAKuHlQsT-YJYkpQnzLKeVMAMZfSIvXPzQBVjkRg==,2001-09-28,"35383 Adams View Suite 773, Jacksontown, UT 65206",Leave environment consumer Democrat responsibility medical audience.,unpaid,found,2876.16,Home Loan
Amanda,Johnson,gAAAAABqAcdujSq2Q_-Xa7DCOFV15S6iBO5NAkiMV6TTADgstlYBFDzlgBaxubRvxMPfp_OiHOvKPeB0egImUcRw-cNOHBezyQ==,1961-11-06,"PSC 8906, Box 6434, APO AE 01937",Toward group easy often visit mean door cold resource three.,paid,found,1066.91,Personal Loan
Brent,Gardner,gAAAAABqAcduOKBRUSxsWQcv6fQ_pzdLEr9tR47HJX9lZwcuTuw-OVJfBapreh_fiwVkoObt-hN66oNPiQFvOTsk-vl9vkAmPA==,1983-10-23,"029 Cruz Vista Apt. 855, Pittmanside, IL 89238",Bar help wish four box read teach safe far half high.,paid,found,3995.4,Credit Card
Sean,Raymond,gAAAAABqAcducB75oBdcsg0wLWU0V-IBYPnxNIX_tbZHJ8w8Y5LHLaX5nG5EN6avg_bNKxjQL8LduMuWrvRGIMXOLouZbpSXqg==,1971-04-04,"6949 Jonathon Parkway Suite 535, New Jonathanmouth, VT 20427",Send prevent note event me let.,unpaid,not_found,3826.01,Credit Card
Mark,Moran,gAAAAABqAcdu5yBqSFnp7cAQa7cMtfSOXgvSWKeHRF1gWPj_JazE5mRbs7huK9AHVpkS0O6vFFI9GWMfBMPkUOw4jg6SlBzruQ==,2003-07-13,"5523 Castro Bypass Suite 325, South Ravenmouth, KS 65987",Rather environment later prove company.,paid,found,4333.22,Credit Card
Colton,Wagner,gAAAAABqAcduAKmZlG2bq2lMHmQuGbMw0sg77JyHirWfpsRbDu0ci29cAhPPi5PmcKud3LC-jaZjI17QkLaCpyNqcIdOYJa84w==,1964-11-08,"94674 Holder Roads Suite 313, Schwartzland, KS 58119",Write power rate opportunity quickly whole debate huge race.,paid,found,307.13,Home Loan
Rachel,Rodriguez,gAAAAABqAcduFVeaQXxkZCqgq-n6HC6Mv_tz8c2D1cyi1XQu8VAvlHOW0j4Q2Ha1SdmB-X3GJI_EoUrB-EUnLGrFENIL0SIETw==,1999-01-21,"010 Duane Skyway Suite 914, Barnesborough, NY 82971",Catch range three music clear term movement two article.,paid,found,2065.09,Home Loan
Matthew,Garcia,gAAAAABqAcdu6a5yqSk6NCgkRVVOF8nADWyJzddg28p02A2tiWqrB8QZJjvnoIRUyhEoQac-uSn1sGdc7xJEo_B9sQakn0x4cg==,1956-03-04,"92797 Carter Crossroad, Santosside, NY 86650",Quickly information goal common only.,paid,not_found,721.66,Home Loan
Albert,Martinez,gAAAAABqAcduNZRJjeZ_pQVmDFza4I--2XQa4PCdDFOIWZqP5DV-oGc9Xsd9OVcWQFXQpnbbOJ6sIupuoXcqHEctc9d24rDCwg==,1962-10-14,"76295 Connie Views, West Georgeshire, MS 55932",Enter trip become after spend really which bar off front.,paid,found,3140.69,Credit Card
Nicole,Miller,gAAAAABqAcduWOxhtxe6Vh3_C2G94C9DfiNC7qQJt14786bissk1Lzc25sb-xQlYyYH5aYEudipjZscIkWa8NVebmYSYxLJe5A==,1995-01-10,"3614 Justin Radial Apt. 069, Jennifermouth, NM 62377",Assume executive of growth.,paid,found,4823.34,Home Loan
Thomas,Brown,gAAAAABqAcduyO4KLfcHowPUTog2G1oN0Ka6GgHI8eu5NKSEWHEq1dMHiIa9Zdgruv0MyOW27R7msze8frewkKZoRoWSfJ1kHw==,1949-05-08,"3301 Flores Ferry Suite 387, Buckview, NJ 39271",Throw firm radio economy suggest art ago.,unpaid,found,964.38,Personal Loan
Daniel,Garcia,gAAAAABqAcduSUrlbYe4kwSM6d79PRHuO1Tsh-rbguFPL8nRjqKY1VhaF9n9HUTaM0BCfm_MmfuY-10p6dBPVg6E8S1x5nVnTQ==,1984-02-07,"462 Diane Cape, East Ruth, NM 76492",Room next president skill next computer store the strategy.,unpaid,found,4997.57,Credit Card
Scott,Melton,gAAAAABqAcdunAVsmyiXywk4S4Q2OVxD477-E5b7kRw6pmxmH7j2yrMpYs3RzaeiGkBCZ_XMh78SclmAoDZw1KwL0cMo8xBg4g==,2003-06-12,"4098 Alex Roads Apt. 958, Barbaraview, DC 70636",While week dog skin perhaps four very stay.,unpaid,not_found,3352.15,Credit Card
Heather,Baxter,gAAAAABqAcduS67D15cJHtccey7ISSjgunDt0t0fuhpFELx1V5sTMFDbn-0M6NVvtJIaBdasey5GUhNo4vRpTGsGrGZ2r0pJiw==,1986-10-04,"6134 Hughes Row Suite 693, Mooreville, DC 16340",Discussion impact account make fact.,unpaid,not_found,2094.85,Credit Card
Timothy,Walters,gAAAAABqAcduBZOwmUdVFvPercW8NLs7pcptfsjMoB5q07wCHKXupXVcpEEaDxqQh1hD_tCHCe9g2Gotafs39D97H2ib5_023g==,1949-11-27,"Unit 1132 Box 0571, DPO AE 63499",Very five city mouth draw.,paid,found,3255.46,Home Loan
Mackenzie,Santos,gAAAAABqAcduPECNd0hPihXuwnSWczhLxQM0_AwPPYmJpBaaAelCahlp2U7N-1RUiEiSXfRzZyDMPIbnjf9s8jwfLTpQ7c1JRQ==,1950-10-01,"PSC 5698, Box 8353, APO AA 99334",Design lose military language fly.,unpaid,not_found,4480.25,Home Loan
Amanda,Davis,gAAAAABqAcdueIMx5JcLlG-2OxrKk6jsAgzyDCJd6ay5dxyUC1VQKMC-T2GHGOXg477Cy_QXABAMXcsdZgwWNrvvH39MYSY3Dw==,1958-05-24,"63524 Stein Bridge, New Jesus, WV 94485",Me event watch rate see position.,paid,not_found,3272.69,Home Loan
Courtney,Edwards,gAAAAABqAcduTXByDxZbiXWsChr2tjtTggMohfGfASOBQf-ia4SURYFKGaUJ0AlV2mW02j6C-T7Ag_Z9Qn5vqsCThcS1kdg90g==,1982-09-02,"457 Kim Vista Suite 569, New Paulton, PA 18496",Role provide save ask after system radio suffer story.,paid,not_found,283.61,Credit Card
Christine,Brown,gAAAAABqAcduARYBRdPq7Ps1C4OrX-xH8mUdNQ-ZRYb6tfCYlksOghrHLvVbBF4FWbgV85LwbdmT1Mxz-RuJSVazhh4NEo0L3A==,1953-05-30,"806 Martinez Orchard Apt. 695, Ewingchester, MI 34621",We husband part fall like there.,unpaid,found,3668.27,Home Loan
Allen,Dudley,gAAAAABqAcduwZ2r-PMeSs9rLxyzdid1b6bIaOpf-M8woFHiPnxmXeeUqfa0UkAXEkv4gMm3fksHTQoFcKcjQQaDmEHv3wq9lw==,1962-09-27,"2104 Brown Cove Suite 924, North Tammychester, WA 27735",Interview establish machine could all area religious professor little.,unpaid,found,1461.25,Home Loan
Terry,Fry,gAAAAABqAcduDhbHSA4lBfMUcO7dQN2SzY41ghhc2mPIf7VTZULCGebFYoNj7FGWT0uK_iDsVvd-mrJTz8sT2RR4BHp56iJiGA==,1986-07-04,"PSC 5885, Box 5074, APO AP 74362",Nice conference available ten human yourself who thought.,unpaid,found,1467.02,Home Loan
Tara,Berger,gAAAAABqAcduMDBZ3PLJl4O8EpGG7JMFfsY9GaoQsuqA6STHUyFUCIEHwc4SpdWDgHhC0tZnBJvjj5PebL_JnNm5Xy7tMA4Bww==,2006-01-09,"22749 Cunningham Locks Suite 871, South Danielland, MD 09591",Employee around realize require himself far air provide realize.,paid,found,2392.03,Credit Card
Maurice,Cantrell,gAAAAABqAcduZJM0HvjutJwEVpOLDDDgyON4-S9JmOCW-YrRSic8RvchN58ekb8cDdlwnATfPOrKKL_WPTEBGRvB_NC7KW-zJA==,1964-02-18,"8358 Soto Trafficway, New Elizabethside, RI 23477",North everything bring future produce theory down region speech join always.,unpaid,found,2009.17,Credit Card
Brian,Mendoza,gAAAAABqAcduxekVdUcy67Z4DR_EkJjXjItr0JVECLFlrov0PXFIpgHZTbVMTxAioyZuGKZAgbb5KkyHDRqsDbf0jghHh2WuXA==,1946-05-15,"USNS Robinson, FPO AA 89958",Spend one office least sound successful speak game less American.,paid,found,4736.3,Home Loan
Matthew,Chavez,gAAAAABqAcduhw1LIKz7LTQSIR4InQ3Dy8lLTx476P8KJyFSgGJbrCJj4z9qim7W9tzFjW_hrj-lnLhfAdLchHSy8Sh5kKyDHQ==,1983-09-07,"47074 Evans Plaza Suite 535, North Jennifer, HI 87807",Owner interest entire you animal.,unpaid,not_found,1545.71,Personal Loan
Kirk,Hoffman,gAAAAABqAcduFRkyh8sF10dk83fNvx95RUiQTKfP80RSs4vbrFfCEnepCqeFFN-QZ1Rolj-4YW259qzVJ5zpqwKVlmJfweclVA==,1988-11-27,"47229 Lisa Stravenue Suite 912, West Mark, AK 04020",Themselves research likely accept close enjoy perhaps customer wear southern.,paid,not_found,4706.46,Personal Loan
Sarah,Hall,gAAAAABqAcduxzLxYJNXAHtVkWC-_Pto6glfFK61fLYnm7E0KoVVFk2rXQ4_rJSqBibiyrd008cqhpSYYZmh18_Cie8GaCzshQ==,1958-12-27,"24511 Nicole Shoals Apt. 069, New Rebecca, ME 42025",See course wide watch firm cell safe here.,unpaid,found,1858.95,Home Loan
Marc,Luna,gAAAAABqAcdueZ1bLOg6LO3LhAi8KqmZ30EHz8EDMj2LDH70wr-xqI91xnWygdtyxQ-mBB6_zMkQoB1yxOetQLEKhYdm2LiXKA==,1961-01-13,"5267 Justin Pine Suite 334, Josephstad, NC 15408",Worry someone perform shoulder space of expect study.,paid,not_found,1976.12,Home Loan
Brandon,Green,gAAAAABqAcduZwaFhZua6N7a8xcDLSukunuVvIZtiAL7beitvY8SL0d2WfHpdhJc6vNtWHcp80S9hcYZwJJh5VbQn-OlfNF6uQ==,1962-06-11,"39751 Bailey Dam Suite 622, Jonesmouth, IA 81776",Capital mouth rather far medical at book attorney hair.,paid,found,4685.06,Home Loan
Diane,Banks,gAAAAABqAcduAaRF8j7kog3oFSsSILi44E0HCfG2tnoXiLn5WsQ7-BIbPDOZzNAsdzOkfZ97FoBKSz4sScJgMhbQ_jNCfBU3Kw==,2004-03-03,"7567 Linda Mill Suite 903, Mariahside, ID 57843",Affect follow evening radio beyond exactly.,unpaid,not_found,3753.86,Home Loan
Susan,Phillips,gAAAAABqAcdudmVMyJ_uG4ncxyyWXIrF78T1gx-yDE6_mcvVBa2VWMY0T5ZP9T4qsdi5JHWEYh3tEMGW42Y_tGLxCyHZDIM5ng==,1978-01-29,"855 Caleb Fork Suite 404, North Christopher, AZ 64770",Light particularly interview center.,paid,found,3721.59,Home Loan
Monique,Munoz,gAAAAABqAcduT8UI4KRuJbeX7SGOpIrM9x8-ArQtlwJ85ELSQ3j3MqTI9Fzl0wFYEESGj4u58etNnFljaDpKoaN5nclA4ijvaA==,1984-01-28,"863 Barnes Junction, West Robertberg, DC 37135",Once dream national require spring wrong night.,paid,not_found,4634.01,Credit Card
Alan,Roberts,gAAAAABqAcduhLJgmgnemi1q77iBWbWwLXgznDODdB2sZS0r1MeUSyviSkbSsDBX020woOZqMm7g_acq0JLWLAAE8Ag32Sl4kA==,1952-12-22,"610 Melody Bridge, South Michael, TX 15041",True can capital over score probably energy line air.,paid,not_found,3064.54,Credit Card
Jacob,Johnson,gAAAAABqAcduuGBpYesRrPZYNsQUmbPK77lChyphszYeLh5cb9txZM5EYmzsDUQ4x3A4W2186uT6zPw0xJ6Xkj6uRhy5Y75WgQ==,1987-08-09,"50303 Julia Inlet Apt. 944, Davidmouth, MD 42830",While let however throw knowledge within race wall.,unpaid,not_found,1765.83,Home Loan
Vickie,Perez,gAAAAABqAcduRWjgf33PD3EatLi0IIvnKIVt1-wWKr3jPCdWZFahlc1wHLzcpfioJt0lMwBz_gQSZEEKC8zk3YYBIpfZDZHN-A==,1970-01-02,"17973 Dale Dam, New Tiffanyfurt, IN 80438",Situation difficult college three space realize stock skill fire.,paid,found,3009.35,Home Loan
Christopher,Greene,gAAAAABqAcdugsw1Xp7zWZUSnYW8TfohpMUttmMFgc1K1But3e05mPVrROkISJzLEkZ-3vQLVRBPeuQtGTaIzFeAphynBMd1nw==,1952-08-21,"297 Anthony Pine, Bradychester, MD 02953",Nor staff if force.,paid,not_found,1509.72,Home Loan
Veronica,Nguyen,gAAAAABqAcduMsykrLPF7CvEO6CsA6lRN1jCwYrKSFtgzAdpYb8zXR_xMLNmaYiHDcaCotSmV0oWbH2rfWTTMcE0E65uabOouA==,1997-09-01,"28249 Madison Mountain, Mcfarlandberg, TX 88939",Safe clearly material style wish.,paid,not_found,3273.34,Credit Card
Matthew,Miller,gAAAAABqAcduhpCsNq3B4GuCC193tW_zg7wObD-BSJDPfcifUREFA87wHM-vkC9TqNGLHliPRyPTaMV8fJuolGak6sBWMwHLWw==,2001-12-16,"USNS Mclaughlin, FPO AA 96773",Able cup both even open wife.,unpaid,not_found,3129.41,Personal Loan
Amy,Johnson,gAAAAABqAcdub9iqvbsWOjKDD8tsK0_g3Wqiz99TB9ILzoYZbW2FWnjXeCUK12vUJ8TmNwZr_6S2VXAw4WyiCSz3uyLJ5zWv1w==,1948-08-31,"Unit 9086 Box 8943, DPO AE 57871",Bill side term hit behind energy matter personal example.,unpaid,found,4803.69,Home Loan
Benjamin,Lee,gAAAAABqAcduenNCeHOfCRb4RhD-ax1IL3v7c6z5XQ5pRmdJ0-KkPfRmowj-1mb8Cew5l3tmlsROnc2uCRpFNihZNosEeGUUew==,1962-01-18,"388 Tina Views Suite 946, West Michaelshire, LA 20397",Live fish class according activity.,paid,found,2376.08,Credit Card
Sarah,Walters,gAAAAABqAcdugCpoufF2BXK86f--Ua1y7qTb7rArhbPiY4TxLRCXkrZ3QovH4VJ6QZ7byaFtdsPl2BNKmQsgvMbPmVvTJTvzmg==,1999-02-02,"7354 Rebecca Trail Suite 572, South Mariaside, ID 43433",Charge clearly field common show serve church.,unpaid,found,539.67,Personal Loan
Sonia,George,gAAAAABqAcdulQg5pjfiA1cojId1CQVhUyBzaLv7h636jwGAlBdByzyAEzrBXk9qL-Wh1rzqz11xN77xIrFboOR9weeBa0hVHQ==,1988-07-17,"498 Andrew Way, East Jennifer, NH 95638",Green small parent maintain produce.,paid,not_found,2894.25,Home Loan
